{
  "schema_version": 1,
  "message_id": "018f7a3b-4c5d-6e7f-8a9b-0c1d2e3f4a5b",
  "sender_instance_id": "python-worker-01",
  "sender_sequence": 42,
  "market_id": "market-123",
  "contract_or_outcome_id": "yes",
  "market_definition_version": "sha256:abc123def456",
  "event_id": "event-456",
  "underlying_event_group_id": "group-789",
  "forecast_target": "Will event X occur by date Y?",
  "forecast_horizon": "7d",
  "source_id": "news-article-001",
  "source_version": "v1",
  "evidence_set_hash": "a1b2c3d4e5f6a7b8c9d0e1f2a3b4c5d6e7f8a9b0c1d2e3f4a5b6c7d8e9f0a1b2",
  "published_at": "2026-07-15T08:00:00Z",
  "first_source_available_at": "2026-07-15T08:00:00Z",
  "ingested_at": "2026-07-15T08:00:01Z",
  "revision_id": "rev-001",
  "model_artifact_hash": "sha256:model-hash",
  "model_training_cutoff": "2026-07-14T00:00:00Z",
  "ensemble_version": "v2.1",
  "component_model_versions": {"base": "v1.0", "specialized": "v0.9"},
  "prompt_version": "v3",
  "retrieval_corpus_version": "v1",
  "calibration_model_version": "v2",
  "calibration_training_cutoff": "2026-07-14T00:00:00Z",
  "raw_model_probability": 650000,
  "calibrated_probability": 625000,
  "uncertainty_lower": 570000,
  "uncertainty_upper": 680000,
  "uncertainty_coverage_level": 0.90,
  "uncertainty_method": "conformal",
  "abstention_reason": null,
  "decision_cutoff_at": "2026-07-15T08:00:00Z",
  "forecast_created_at": "2026-07-15T08:00:01Z",
  "forecast_emitted_at": "2026-07-15T08:00:02Z",
  "expires_at": "2026-07-15T08:05:00Z"
}
